title,url,description,genres
La main coupée,https://www.goodreads.com/book/show/2185783.La_main_coup_e,"""- Comment, vous ne savez pas ? Asseyez-vous...Ce n'était pas encore l'heure du thé. Nous étions seuls dans la boutique. Et tout en me faisant goûter des bouchées au chocolat, grignoter des petits fours et déguster un verre de xérès, la nouvelle confiseuse, qui était veuve de guerre, me raconta avec beaucoup, beaucoup de détails, qui avaient tous trait à sa propre situation, comment Claire s'était pendue dans son fournil le jour où un message officiel d'Angleterre lui avait appris la mort atroce de son frère..."""" Salut cher Blaise Cendrars ! tu es musicien. Salut ! Et gloire à toi ! Autant que des autres, nous avons besoin des poètes de la nuit et de la désolation. Autant que de diatribes au vitriol, nous avons besoin de mots réconfortants - et tu nous les apportes ! "" (Henry Miller)La main coupée est un monument aux morts de la Grande Guerre, comme ceux sur lesquels on a inscrit, année par année, les noms des disparus, morts identifiés mais morts obscurs, sans gloire. Blaise Cendrars a prélevé dans sa mémoire les bribes de la vie et de la mort de ses compagnons de combat, des hommes ordinaires, tragiques ou cocasses, échappant à toute vision héroïque ou édifiante. Lorsqu'elle paraît en 1946, La main coupée est plus qu'un témoignage retardé, c'est une réparation. Réparation parce qu'elle est un mémorial contre l'oubli, réparation aussi pour son auteur qui, dans cet ouvrage tardif, s'autorise enfin, librement, à parler longuement de la guerre, de sa guerre, comme il ne l'avait jamais fait, comme personne ne l'avait jamais fait.","['History', 'France', 'War', 'Roman', 'World War I', 'Memoir', 'French Literature', 'Classics', 'Literature', '20th Century']"
Selections from the Prison Notebooks,https://www.goodreads.com/book/show/85935.Selections_from_the_Prison_Notebooks,"Antonio Gramsci (1891-1937) is widely celebrated as the most original political thinker in Western Marxism and an all-around outstanding intellectual figure. Arrested and imprisoned by the Italian Fascist regime in 1926, Gramsci died before fully regaining his freedom. Nevertheless, in his prison notebooks, he recorded thousands of brilliant reflections on an extraordinary range of subjects, establishing an enduring intellectual legacy.Columbia University Press's multivolume Prison Notebooks is the only complete critical edition of Antonio Gramsci's seminal writings in English. The notebooks' integral text gives readers direct access not only to Gramsci's influential ideas but also to the intellectual workshop where those ideas were forged. Extensive notes guide readers through Gramsci's extraordinary series of reflections on an encyclopedic range of topics. Volume 3 contains notebooks 6, 7, and 8, in which Gramsci develops his concepts of hegemony, civil society, and the state; reflects extensively on the Renaissance, the Reformation, and Machiavelli's political philosophy; and offers a trenchant critique of the cultural and political practices of fascism. A detailed analysis of positivism and idealism brings Gramsci's philosophy of praxis and conception of historical materialism into sharp relief. Also included are the author's extensive observations on articles and books read during his imprisonment.","['Philosophy', 'Politics', 'Nonfiction', 'Theory', 'History', 'Sociology', 'Economics', 'Essays', 'Italy', 'Italian Literature']"
A Moon for the Misbegotten,https://www.goodreads.com/book/show/150144.A_Moon_for_the_Misbegotten,"A new, affordable paperback edition of one O’Neill’s late masterpiecesEugene O’Neill’s last completed play, A Moon for the Misbegotten is a sequel to his autobiographical Long Day’s Journey Into Night. Moon picks up eleven years after the events described in Long Day’s Journey Into Night , as Jim Tyrone (based on O’Neill’s older brother Jamie) grasps at a last chance at love under the full moonlight. This paperback edition features an insightful introduction by Stephen A. Black, helpful to anyone who desires a deeper understanding of O’Neill’s work.","['Plays', 'Drama', 'Theatre', 'Classics', 'Fiction', 'American', 'Literature', 'Romance', '20th Century', 'Americana']"
Adam of the Road,https://www.goodreads.com/book/show/164255.Adam_of_the_Road,"""A road's a kind of holy thing,"" said Roger the Minstrel to his son, Adam. ""That's why it's a good work to keep a road in repair, like giving alms to the poor or tending the sick. It's open to the sun and wind and rain. It brings all kinds of people and all parts of England together. And it's home to a minstrel, even though he may happen to be sleeping in a castle.""And Adam, though only eleven, was to remember his father's words when his beloved dog, Nick, was stolen and Roger had disappeared and he found himself traveling alone along these same great roads, searching the fairs and market towns for his father and his dog.Here is a story of thirteenth-century England, so absorbing and lively that for all its authenticity it scarcely seems ""historical."" Although crammed with odd facts and lore about the time when ""longen folke to goon on pilgrimages,"" its scraps of song and hymn and jongleur's tale of the period seem as newminted and fresh as the day they were devised, and Adam is a real boy inside his gay striped surcoat.","['Historical Fiction', 'Fiction', 'Childrens', 'Young Adult', 'Classics', 'Historical', 'Medieval', 'Middle Grade', 'Adventure', 'School']"
The Case of the Empty Tin,https://www.goodreads.com/book/show/1697615.The_Case_of_the_Empty_Tin,"A spanking-new tin can, secretly placed among the rows of Mrs. Florence Gentrie's preserves, contains not a speck of food  but it does carry one very damning clue to a murder that took place right next door. Such an unsavory discovery in such an unlikely place can't help but pique the curiosity of a dedicated mystery hunter like Perry Mason.But the real mystery about this murder is who  and where  is the victim? Upstairs neighbor Elston A. Karr heard the telltale sounds of foul play, but his foul temperament (and his own dark secrets) make him most uncooperative. It takes a second murder to clear up the mystery of the missing body  and to make Perry Mason the next prime candidate to disappear....","['Mystery', 'Fiction', 'Crime', 'Detective', 'Audiobook', 'Novels', 'Legal Thriller', 'American', 'Mystery Thriller']"
The Clue of the Rusty Key,https://www.goodreads.com/book/show/4671377-the-clue-of-the-rusty-key,"The Danas are thrust into the middle of a dispute between Oliver Pritz Gormly and Jasper Conway. The girls rescue Conway and his important papers when Gormly sets fire to Conway's store. Later, when Pritz confronts the girls and orders them to turn over the papers, the girls refuse, earning themselves a new enemy.Jean and Louise learn that Gormly is a swindler, cheating many people, including their classmate Lettie Briggs, who refuses to believe that Gormly is dishonest. Jean and Louise can do little to help Lettie since she refuses to talk to the Danas, but the girls befriend several other victims as they search for clues.The girls face many difficulties before they finally bring Dr. Gormly to justice.",['Mystery']
A Preface to Paradise Lost,https://www.goodreads.com/book/show/207546.A_Preface_to_Paradise_Lost,"Examines the style, content, structure, and themes of Milton's classic within the context of Western literary tradition","['Nonfiction', 'Literary Criticism', 'Classics', 'Poetry', 'Literature', 'Religion', 'Christian', 'Theology', 'Christianity', 'Criticism']"
A Russian Journal,https://www.goodreads.com/book/show/779074.A_Russian_Journal,"Steinbeck and Capa’s account of their journey through Cold War Russia is a classic piece of reportage and travel writing.Just after the Iron Curtain fell on Eastern Europe, Pulitzer Prize-winning author John Steinbeck and acclaimed war photographer Robert Capa ventured into the Soviet Union to report for the New York Herald Tribune. This rare opportunity took the famous travelers not only to Moscow and Stalingrad – now Volgograd – but through the countryside of the Ukraine and the Caucasus. Hailed by the New York Times as ""superb"" when it first appeared in 1948, is the distillation of their journey and remains a remarkable memoir and unique historical document.What they saw and movingly recorded in words and on film was what Steinbeck called ""the great other side there … the private life of the Russian people."" Unlike other Western reporting about Russia at the time, is free of ideological obsessions. Rather, Steinbeck and Capa recorded the grim realities of factory workers, government clerks, and peasants, as they emerged from the rubble of World War II—represented here in Capa’s stirring photographs alongside Steinbeck’s masterful prose.Through it all, we are given intimate glimpses of two artists at the height of their powers, answering their need to document human struggle. This edition features an introduction by Steinbeck scholar Susan Shillinglaw.","['Nonfiction', 'Travel', 'Russia', 'History', 'Classics', 'American', 'Memoir', 'Biography', 'Journalism', 'The United States Of America']"
The Case of the Buried Clock,https://www.goodreads.com/book/show/16773.The_Case_of_the_Buried_Clock,"After catching his shady son-in-law, Jack Hardisty, in the act of embezzling, wealthy banker Vincente Blane plans to hang him out to dry. Then murder turns Blane’s restful mountain retreat into Hardisty’s final resting place.When the evidence points to wronged wife Millicent, her father makes a point of calling in Perry Mason. And it’s up to the legendary legal eagle to unravel the case’s most baffling a buried clock at the murder scene. But as time runs short, the ticking of the clock sounds more and more like the rattling of family skeletons that everyone wants silenced…","['Mystery', 'Fiction', 'Crime', 'Detective', 'Thriller', 'Pulp', 'Legal Thriller', 'Novels', 'Classics']"
City Boy,https://www.goodreads.com/book/show/113817.City_Boy,"An ""enormously entertaining"" portrait of ""a Bronx Tom Sawyer"" ( San Francisco Chronicle ), City Boy is a sharp and moving novel of boyhood from Pulitzer Prize winner Herman Wouk.A hilarious and often touching tale of an urban kid's adventures and misadventures on the street, in school, in the countryside, always in pursuit of Lucille, a heartless redhead personifying all the girls who torment and fascinate pubescent lads of eleven.","['Fiction', 'Historical Fiction', 'Classics', 'Coming Of Age', 'Humor', 'Young Adult', 'Audiobook', 'Jewish', 'New York', 'Literature']"
Green Grass of Wyoming,https://www.goodreads.com/book/show/253676.Green_Grass_of_Wyoming,"In the third book of the ""Flicka"" trilogy, Ken discovers to his horror that Thunderhead is roaming wild, causing trouble wherever he goes. He also has trouble at home, and thinks that his dreams can never come true; but then his feelings for Carey begin to change.","['Horses', 'Fiction', 'Young Adult', 'Animals', 'Childrens', 'Classics', 'Historical Fiction', 'Romance', 'Westerns', 'American']"
Requiem,https://www.goodreads.com/book/show/297194.Requiem,"Ces poèmes qui forment le Requiem et dont on lira ici la traduction, s'échelonnent entre les années 1930 et 1957. À l'exception du poème « Le Verdict » (publié sans titre en 1961), ils n'ont jamais été jusqu'à présent édités en U.R.S.S. Le Requiem a parue en langue russe, en décembre 1963, à Munich, par les soins de Tovarichtchestvo Zaroubiejnick Pissatielieï. Le livre est précédé de l'avertissement suivant :« Cette suite de poèmes nous est parvenue de Russie et nous la publions à l'insu de l'Auteur et sans son consentement. »P. V.","['Poetry', 'Russia', 'Classics', 'Russian Literature', 'Fiction', 'School', 'Literature', '20th Century']"
Week-End Wodehouse,https://www.goodreads.com/book/show/18080.Week_End_Wodehouse,"This is a collection from P.G. Wodehouse including Drones Club tales, Mr. Mulliner stories, and stories of Jeeves, Lord Emsworth, and Ukridge. The selection also features extracts from Wodehouse's novels and non-fiction writings.","['Fiction', 'Humor', 'Short Stories', 'Classics', 'British Literature', 'Collections', 'Literature', 'Anthologies', 'Comedy']"
The Very Old Folk,https://www.goodreads.com/book/show/9805770-the-very-old-folk,"""The Very Old Folk"" is a short story by American horror fiction writer H. P. Lovecraft. It is reportedly a recording of a dream, where the main protagonist is a Roman military official in Hispania. The countryside is, every year, ravaged by terrible hill people who kidnap citizens and perform cruel rituals at a Sabath. The narrator wishes to lead a military expedition to crush these hill folk, as a feeling of approaching evil has enveloped the countryside, due to a riot between the citizens and the hill people. These hill folk came to trade, yet some of these are killed and later, no disappearances occur before the time of the Sabath. The incursion is guided by a local-born son of Roman parents. As the Romans approach the seat of the Sabath rituals, something terrible attacks them and in an instant, horrible things come to""He had killed himself when the horses screamed... He, who had been born and lived all his life in that region, and knew what men whispered about the hills. All the torches now began to dim, and the cries of frightened legionaries mingled with the unceasing screams of the tethered horses. The air grew perceptibly colder, more suddenly so than is usual at November's brink, and seemed stirred by terrible undulations which I could not help connecting with the beating of huge wings.""The story ends with the narrator waking up, offering one final word of""Of the fate of that cohort no record exists, but the town at least was saved - for encyclop?dias tell of the survival of Pompelo to this day, under the modern Spanish name of Pompelona..."" .","['Horror', 'Lovecraftian', 'Short Stories', 'Fiction', 'Fantasy', 'Historical Fiction', 'Weird Fiction', 'Classics', 'Gothic', 'Time Travel']"
The Four-Story Mistake,https://www.goodreads.com/book/show/421642.The_Four_Story_Mistake,"The Melendy family moves from their New York City brownstone to an odd old house in the country. Mona, 13, actress-to-be, recites poetry at the drop of a hat. Rush, 12, is a bit mischievous. Miranda, 10, dances and paints pictures. Oliver, 6, is calm and thoughtful. Their father is a writer, so beloved housekeeper Cuffy takes on the motherly role","['Fiction', 'Childrens', 'Middle Grade', 'Juvenile', 'Young Adult', 'Classics', 'Historical Fiction', 'Realistic Fiction', 'Audiobook', 'Family']"
The Case of the Cautious Coquette,https://www.goodreads.com/book/show/183220.The_Case_of_the_Cautious_Coquette,"When Perry Mason questioned Lucille Barton, she lied about her past, about her many marriages, about her gun, about her boyfriends. Then the murders began. And the cops turned up evidence that clearly pointed to one killer--Perry Mason!","['Mystery', 'Fiction', 'Crime', 'Novels', 'Mystery Thriller', 'Detective']"
An Essay on Man: An Introduction to a Philosophy of Human Culture,https://www.goodreads.com/book/show/173282.An_Essay_on_Man,"One of the twentieth century’s greatest philosophers presents the results of his lifetime study of man’s cultural achievements. An Essay on Man is an original synthesis of contemporary knowledge, a unique interpretation of the intellectual crisis of our time, and a brilliant vindication of man’s ability to resolve human problems by the courageous use of his mind.What the thinkers of the past have thought of the human race, what can be said of its art, language, and capacities for good and evil in the light of modern knowledge are discussed by a great philosopher who had a profound experience of the past and of his own time.","['Poetry', 'Philosophy', 'Classics', 'Nonfiction', 'Essays', 'School', 'Literature', 'British Literature', '18th Century', 'English Literature']"
Shadow Castle,https://www.goodreads.com/book/show/1112665.Shadow_Castle,"In the middle of a deep forest is an enchanted valley and a castle where only shadows live, shadows of kings and queens who have waited for hundreds of years for the spell cast upon them to be broken. One day, a girl named Lucy follows a little dog through a tunnel into the valley and meets the mysterious red-haired Michael, who takes her into the shadow world to meet Prince Mika and his mortal wife Gloria, their children and their children's children, and learn the magic that will lift the spell. This new expanded Author's Edition contains additional chapters never published before!","['Fantasy', 'Childrens', 'Fiction', 'Young Adult', 'Fairy Tales', 'Classics', 'Middle Grade', 'Adventure', 'Science Fiction Fantasy', 'High Fantasy']"
The Case of the Half-Wakened Wife,https://www.goodreads.com/book/show/16767.The_Case_of_the_Half_Wakened_Wife,"Case of the Half-Wakened Wife, The: A Perry Mason Mystery, by Gardner, Erle Stanley","['Mystery', 'Fiction', 'Crime', 'Detective', 'Mystery Thriller', 'Novels']"
La bella estate,https://www.goodreads.com/book/show/1739067.La_bella_estate,"""A quei tempi era sempre festa. Bastava uscire di casa e attraversare la strada, per diventare come matte, e tutto era bello, specialmente di notte, che tornando stanche morte speravano ancora che succedesse qualcosa, che scoppiasse un incendio, che in casa nascesse un bambino, o magari venisse giorno all'improvviso e tutta la gente uscisse in strada e si potesse continuare a camminare fino ai prati e fin dietro le colline...""La bella estate (1949) contiene tre romanzi, di cui ciascuno si presenta con una propria autonomia: La bella estate, Il diavolo sulle colline e Tra donne sole. Senza costituire una trilogia, c'è in essi un clima morale, un incontro di temi che li accomuna: sono tre romanzi cittadini (per quanto sempre la campagna, la nitida e favolosa campagna di Pavese vi sia presente), tre romanzi di scoperta della città e della società, di giovanili passioni amorose, d'entusiasmi e sconfitte. Un tema ricorrente in ciascuno dei vari intrecci e ambienti è quello della tentazione, dell'ascendente che i giovani sono tutti condannati a subire. Un altro è la ricerca affannata del vizio, il bisogno baldanzoso di violare la norma, di varcare il limite. Un altro, l'abbattersi della naturale sanzione sul più incolpevole e inerme, sul più ""giovane"". Ma quest'elenco di temi non può render giustizia all'unità e pienezza di ciascuno dei tre romanzi, al suo nitido carattere di studio di un ambiente e di una vicenda, al ritmo della sua prosa.","['Fiction', 'Italian Literature', 'Classics', 'Italy', 'Coming Of Age', '20th Century', 'Romance', 'Literary Fiction', 'Literature', 'Novels']"
Adopted Jane,https://www.goodreads.com/book/show/689269.Adopted_Jane,Life outside the dull orphanage is much better when a young girl goes on a summer vacation with two families.,"['Childrens', 'Fiction', 'Novels', 'Historical', 'Juvenile', 'Adoption', 'Fostering', 'Historical Fiction', 'Young Adult']"
The Little World of Don Camillo,https://www.goodreads.com/book/show/66878.The_Little_World_of_Don_Camillo,"This tragicomical stories, often politically or socially charged, mostly situated in a fictional village on the Po called Boscaccio, in the period immediately after World War II, paint a clear picture of the post-war Italy. In this period the Italian Communist Party is very strong, but the Second World War and fascism are still vividly remembered. Boscaccio has a communist mayor named Peppone. He wants to realise the communist ideals, and the Roman Catholic priest Don Camillo is desperately trying to prevent this. But despite their different views these men can count on each other in the fight against social injustice and abuses.","['Fiction', 'Humor', 'Italy', 'Classics', 'Short Stories', 'Italian Literature', 'Comedy', 'Religion', 'Catholic', 'Historical']"
Seven Types of Ambiguity,https://www.goodreads.com/book/show/34153015-seven-types-of-ambiguity,A short story about a wealthy man and woman who visit a book store to purchase books.,['Short Stories']
Bedknob and Broomstick,https://www.goodreads.com/book/show/474211.Bedknob_and_Broomstick,"In The Magic Bedknob, Carey, Charles and Paul 6 find prim Miss Price injured by falling off her broomstick. For their silence, she bespells a bedknob to carry them where-ever and when-ever. In Bonfires and Broomsticks two years later, they bring necromancer Emelius Jones to visit. But his neighbors want to burn him at the stake for disappearing in the Great Fire of London.","['Fantasy', 'Childrens', 'Classics', 'Fiction', 'Middle Grade', 'Adventure', 'Magic', 'Young Adult', 'Witches', 'Juvenile']"
Killers of the Dream,https://www.goodreads.com/book/show/150193.Killers_of_the_Dream,"""What she sets out to do is to re-create the texture of Southern experience, from infancy to maturity, out of which hatred for the Negro grows."" (The Atlantic) ""Make no mistake. This book goes further than probably any other. It is all out."" (Houston Post)","['Nonfiction', 'Memoir', 'History', 'Race', 'Social Justice', 'Essays', 'American History', 'School', 'Womens', 'Biography']"
Theater Shoes,https://www.goodreads.com/book/show/3782.Theater_Shoes,"A beautiful gift edition of the beloved classic about three orphan siblings and their love of music, theater, and dance. When orphans Sorrel, Mark, and Holly are sent to live with their grandmother, a famous English actress, she enrolls them in the Children's Academy of Dancing and Stage Training, the same Academy that made the orphans from Ballet Shoes famous so long ago. It's the chance of a lifetime, but the Academy won't give the children the ""proper"" education their parents would have wanted. However, the children learn to love the Academy when they find out that Sorrel has dramatic flair, Mark can sing, and Holly charms everyone with her adorable impish ways. Maybe talent does run in the family.This classic children's book is perfect for kids who dream of being on stage--dancing, singing, or acting. Don't miss the other classic Noel Streatfeild books, Ballet Shoes, Skating Shoes, and Dancing Shoes!","['Childrens', 'Fiction', 'Classics', 'Middle Grade', 'Historical Fiction', 'Young Adult', 'Childrens Classics', 'Theatre', 'British Literature', 'Realistic Fiction']"
The Magic Bedknob,https://www.goodreads.com/book/show/7912855-the-magic-bedknob,"An engrossing fantasy about an elderly woman who practices magic for a hobby and three London children evacuated to the country during the bombing of London.This story was later republished, together with Bonfires and Broomsticks, as Bedknobs and Broomsticks.","['Fantasy', 'Childrens', 'Fiction', 'Middle Grade', 'Classics', 'Witches', 'Chapter Books', 'Young Adult', 'Media Tie In', 'Classic Literature']"
Artemisia,https://www.goodreads.com/book/show/179343.Artemisia,"Artemisia Gentileschi, born in 1598, the daughter of an esteemed painter, taught art in Naples and painted the great women of Roman and biblical history. She could neither read nor write, and she was the reviled victim in a public rape trial, rejected by her father, and later abandoned by her husband. Nevertheless, she was one of the first women in modern times to uphold through her work and deeds the right of women to pursue careers compatible with their talents and on an equal footing with men. This edition features a new introduction by the celebrated critic and writer Susan Sontag. Anna Banti, the pen name of Lucia Lopresti, was born in Florence in 1895. Trained as an art historian, she turned to novels, stories, and autobiographical prose in the 1930s. Artemisia , her second novel, published in 1947, is the most acclaimed of the sixteen works of fiction she published during her long life, and is considered a classic of twentieth century Italian literature. Her last, harrowingly confessional novel, A Piercing Cry ( Un grido lacerante ), appeared in 1981. Banti also wrote art criticism and monographs on painters (Lorenzo Lotto, Fra Angelico, Velázquez, Monet), literary criticism and film reviews, and translated novels by Thackery, Colette, Alain Fournier, and Virginia Woolf. She died in Ronchi di Massa (Tuscanny) in 1985.","['Historical Fiction', 'Art', 'Italy', 'Fiction', 'Italian Literature', 'Classics', 'Feminism', 'Womens', '20th Century', 'Literature']"
The Transition of Juan Romero,https://www.goodreads.com/book/show/6457601-the-transition-of-juan-romero,"The story involves a mine that uncovers a very deep chasm, too deep for any sounding lines to hit bottom. The night after the discovery of the abyss the narrator and one of the mine's workers, Juan Romero, venture inside the mine, drawn against their will by a mysterious rhythmical throbbing in the ground.","['Horror', 'Lovecraftian', 'Short Stories', 'Fiction', 'Fantasy', 'Classics', 'Weird Fiction', 'American', 'Cthulhu Mythos', 'Novels']"
Party Shoes,https://www.goodreads.com/book/show/3787.Party_Shoes,"A welcome reissue of the 1945 book. Set during and after the second World War, this classic novel tells the story of Selina, who has been sent to live with her aunt, uncle, and cousins in the country. When Selina receives a parcel from her godmother in America it causes much excitement among her and her cousins, and, to Selina's delight, the parcel contains a beautiful party dress and a pair of party shoes. But delight turns to dismay when she realizes that she may never have an occasion to wear such a wonderful outfit - until, that is, she and her cousins come up with an idea of organizing a pageant...","['Childrens', 'Classics', 'Fiction', 'Historical Fiction', 'Middle Grade', 'Young Adult', 'World War II', 'British Literature', 'Historical', 'Juvenile']"
