title,url,description,genres
1984,https://www.goodreads.com/book/show/61439040-1984,A masterpiece of rebellion and imprisonment where war is peace freedom is slavery and Big Brother is watching Thought Police Big Brother Orwellian These words have entered our vocabulary because of George Orwell s classic dystopian novel 1984 The story of one man s nightmare odyssey as he pursues a forbidden love affair through a world ruled by warring states and a power structure that controls not only information but also individual thought and memory 1984 is a prophetic haunting tale More relevant than ever before 1984 exposes the worst crimes imaginable the destruction of truth freedom and individuality With a foreword by Thomas Pynchon With a foreword by Thomas Pynchon A masterpiece of rebellion and imprisonment where war is peace freedom is slavery and Big Brother is watching View our feature on George Orwell s 1984 Thought Police Big Brother Orwellian These words have entered our vocabulary because of George Orwell s classic dystopian novel 1984 The story of one man s nightmare odyssey as he pursues a forbidden love affair through a world ruled by warring states and a power structure that controls not only information but also individual thought and memory 1984 is a prophetic haunting tale More relevant than ever before 1984 exposes the worst crimes imaginable the destruction of truth freedom and individuality This beautiful paperback edition features deckled edges and french flaps a perfect gift for any occasionAlternate cover edition can be found .,"['Classics', 'Fiction', 'Science Fiction', 'Dystopia', 'Literature', 'Politics', 'Novels', 'School', 'Fantasy', 'Audiobook']"
Animal Farm,https://www.goodreads.com/book/show/170448.Animal_Farm,"Librarian's note: There is an Alternate Cover Edition for this edition of this book here.A farm is taken over by its overworked, mistreated animals. With flaming idealism and stirring slogans, they set out to create a paradise of progress, justice, and equality. Thus the stage is set for one of the most telling satiric fables ever penned –a razor-edged fairy tale for grown-ups that records the evolution from revolution against tyranny to a totalitarianism just as terrible.When was first published, Stalinist Russia was seen as its target. Today it is devastatingly clear that wherever and whenever freedom is attacked, under whatever banner, the cutting clarity and savage comedy of George Orwell’s masterpiece have a meaning and message still ferociously fresh.","['Classics', 'Fiction', 'Dystopia', 'Fantasy', 'School', 'Literature', 'Science Fiction', 'Novels', 'Read For School', 'Philosophy']"
The Diary of a Young Girl,https://www.goodreads.com/book/show/48855.The_Diary_of_a_Young_Girl,"Discovered in the attic in which she spent the last years of her life, Anne Frank’s remarkable diary has become a world classic—a powerful reminder of the horrors of war and an eloquent testament to the human spirit.In 1942, with the Nazis occupying Holland, a thirteen-year-old Jewish girl and her family fled their home in Amsterdam and went into hiding. For the next two years, until their whereabouts were betrayed to the Gestapo, the Franks and another family lived cloistered in the “Secret Annexe” of an old office building. Cut off from the outside world, they faced hunger, boredom, the constant cruelties of living in confined quarters, and the ever-present threat of discovery and death. In her diary Anne Frank recorded vivid impressions of her experiences during this period. By turns thoughtful, moving, and surprisingly humorous, her account offers a fascinating commentary on human courage and frailty and a compelling self-portrait of a sensitive and spirited young woman whose promise was tragically cut short.--back cover","['Classics', 'Nonfiction', 'Biography', 'Memoir', 'Historical', 'Holocaust', 'Autobiography']"
The Little Prince,https://www.goodreads.com/book/show/157993.The_Little_Prince,"A pilot stranded in the desert awakes one morning to see, standing before him, the most extraordinary little fellow. ""Please,"" asks the stranger, ""draw me a sheep."" And the pilot realizes that when life's events are too difficult to understand, there is no choice but to succumb to their mysteries. He pulls out pencil and paper... And thus begins this wise and enchanting fable that, in teaching the secret of what is really important in life, has changed forever the world for its readers.Few stories are as widely read and as universally cherished by children and adults alike as , presented here in a stunning new translation with carefully restored artwork. The definitive edition of a worldwide classic, it will capture the hearts of readers of all ages.","['Fiction', 'Fantasy', 'Childrens', 'France', 'Philosophy', 'Young Adult', 'Literature', 'Middle Grade', 'French Literature', 'School']"
The Stranger,https://www.goodreads.com/book/show/49552.The_Stranger,"Published in 1942 by French author Albert Camus, The Stranger has long been considered a classic of twentieth-century literature. Le Monde ranks it as number one on its ""100 Books of the Century"" list. Through this story of an ordinary man unwittingly drawn into a senseless murder on a sundrenched Algerian beach, Camus explores what he termed ""the nakedness of man faced with the absurd.""","['Classics', 'Fiction', 'Philosophy', 'France', 'Literature', 'Novels', 'French Literature', 'School', 'Literary Fiction', '20th Century']"
A Streetcar Named Desire,https://www.goodreads.com/book/show/12220.A_Streetcar_Named_Desire,"The Pulitzer Prize and Drama Critics Circle Award winning play—reissued with an introduction by Arthur Miller (Death of a Salesman and The Crucible), and Williams’ essay “The World I Live In.”It is a very short list of 20th-century American plays that continue to have the same power and impact as when they first appeared—57 years after its Broadway premiere, Tennessee Williams’ A Streetcar Named Desire is one of those plays. The story famously recounts how the faded and promiscuous Blanche DuBois is pushed over the edge by her sexy and brutal brother-in-law, Stanley Kowalski. launched the careers of Marlon Brando, Jessica Tandy, Kim Hunter, and Karl Malden, and solidified the position of Tennessee Williams as one of the most important young playwrights of his generation, as well as that of Elia Kazan as the greatest American stage director of the ’40s and ’50s.","['Plays', 'Classics', 'Fiction', 'Drama', 'School', 'Read For School', 'Literature', 'American', 'Theatre', '20th Century']"
For Whom the Bell Tolls,https://www.goodreads.com/book/show/46170.For_Whom_the_Bell_Tolls,"In 1937 Ernest Hemingway traveled to Spain to cover the civil war there for the North American Newspaper Alliance. Three years later he completed the greatest novel to emerge from ""the good fight,"" For Whom the Bell Tolls. The story of Robert Jordan, a young American in the International Brigades attached to an antifascist guerilla unit in the mountains of Spain, it tells of loyalty and courage, love and defeat, and the tragic death of an ideal. In his portrayal of Jordan's love for the beautiful Maria and his superb account of El Sordo's last stand, in his brilliant travesty of La Pasionaria and his unwillingness to believe in blind faith, Hemingway surpasses his achievement in and to create a work at once rare and beautiful, strong and brutal, compassionate, moving and wise. ""If the function of a writer is to reveal reality,"" Maxwell Perkins wrote to Hemingway after reading the manuscript, ""no one ever so completely performed it."" Greater in power, broader in scope, and more intensely emotional than any of the author's previous works, it stands as one of the best war novels of all time.","['Classics', 'Fiction', 'Historical Fiction', 'Literature', 'War', 'Novels', 'American', 'Spain', 'Classic Literature', 'Literary Fiction']"
Pippi Longstocking,https://www.goodreads.com/book/show/19302.Pippi_Longstocking,"Tommy and his sister Annika have a new neighbor, and her name is Pippi Longstocking. She has crazy red pigtails, no parents to tell her what to do, a horse that lives on her porch, and a flair for the outrageous that seems to lead to one adventure after another!","['Classics', 'Childrens', 'Fiction', 'Middle Grade', 'Young Adult', 'Fantasy', 'Humor']"
Death of a Salesman,https://www.goodreads.com/book/show/12898.Death_of_a_Salesman,"'For a salesman, there is no rock bottom to life. He don't put a bolt to a nut, he don't tell you the law or give you medicine. He's a man way out there in the blue, riding on a smile and a shoeshine.'Willy Loman has been a salesman for 34 years. At 60, he is cast aside, his usefulness now exhausted. With no future to dream about he must face the crushing disappointments of his past. He takes one final brave action, but is he heroic at last?, or a self-deluding fool?","['Classics', 'Plays', 'Fiction', 'Drama', 'School', 'Theatre', 'Literature', 'Read For School', 'High School', 'American']"
A Tree Grows in Brooklyn,https://www.goodreads.com/book/show/14891.A_Tree_Grows_in_Brooklyn,"The beloved American classic about a young girl's coming-of-age at the turn of the century, Betty Smith's A Tree Grows in Brooklyn is a poignant and moving tale filled with compassion and cruelty, laughter and heartache, crowded with life and people and incident. The story of young, sensitive, and idealistic Francie Nolan and her bittersweet formative years in the slums of Williamsburg has enchanted and inspired millions of readers for more than sixty years. By turns overwhelming, sublime, heartbreaking, and uplifting, the daily experiences of the unforgettable Nolans are raw with honesty and tenderly threaded with family connectedness -- in a work of literary art that brilliantly captures a unique time and place as well as incredibly rich moments of universal experience.","['Fiction', 'Historical Fiction', 'Classics', 'Young Adult', 'Coming Of Age', 'Historical', 'New York', 'Literature', 'Novels', 'Book Club']"
The Plague,https://www.goodreads.com/book/show/11989.The_Plague,"The Plague is a novel by Albert Camus, published in 1947.It tells the story from the point of view of a narrator of a plague sweeping the French Algerian city of Oran. The narrator remains unknown until the start of the last chapter, chapter 5 of part 5. The novel presents a snapshot of life in Oran as seen through the author's distinctive absurdist point of view.The book tells a gripping tale of human unrelieved horror, of survival and resilience, and of the ways in which humankind confronts death, is at once a masterfully crafted novel, eloquently understated and epic in scope, and a parable of ageless moral resonance, profoundly relevant to our times. In Oran, a coastal town in North Africa, the plague begins as a series of portents, unheeded by the people. It gradually becomes an omnipresent reality, obliterating all traces of the past and driving its victims to almost unearthly extremes of suffering, madness, and compassion.The Plague is considered an existentialist classic despite Camus' objection to the label. The novel stresses the powerlessness of the individual characters to affect their destinies. The narrative tone is similar to Kafka's, especially in The Trial, whose individual sentences potentially have multiple meanings; the material often pointedly resonating as stark allegory of phenomenal consciousness and the human condition.","['Fiction', 'Classics', 'Philosophy', 'France', 'Literature', 'French Literature', 'Novels', '20th Century', 'Literary Fiction', 'Historical Fiction']"
Goodnight Moon,https://www.goodreads.com/book/show/32929.Goodnight_Moon,"In a great green room, tucked away in bed, is a little bunny. ""Goodnight room, goodnight moon."" And to all the familiar things in the softly lit room -- to the picture of the three little bears sitting on chairs, to the clocks and his socks, to the mittens and the kittens, to everything one by one -- the little bunny says goodnight.In this classic of children's literature, beloved by generations of readers and listeners, the quiet poetry of the words and the gentle, lulling illustrations combine to make a perfect book for the end of the day.","['Childrens', 'Picture Books', 'Classics', 'Fiction', 'Poetry', 'Kids', 'Animals', 'Juvenile', 'Young Adult', 'Storytime']"
The Screwtape Letters,https://www.goodreads.com/book/show/8130077-the-screwtape-letters,"A Masterpiece of Satire on Hell’s Latest Novelties and Heaven’s Unanswerable AnswerC.S. Lewis’s The Screwtape Letters has entertained and enlightened readers the world over with its sly and ironic portrayal of human life and foibles from the unique vantage point of Screwtape, a highly placed assistant to “Our Father Below.” At once wildly comic, deadly serious, and strikingly original, C.S. Lewis gives us the correspondence of the wordly-wise devil to his nephew Wormwood, a novice demon in charge of securing the damnation of an ordinary young man. The Screwtape Letters is the most engaging account of temptation—and triumph over it—ever written. ","['Fiction', 'Christian', 'Classics', 'Religion', 'Christianity', 'Fantasy', 'Theology', 'Christian Fiction', 'Faith', 'Philosophy']"
Brideshead Revisited,https://www.goodreads.com/book/show/30933.Brideshead_Revisited,"The most nostalgic and reflective of Evelyn Waugh's novels, Brideshead Revisited looks back to the golden age before the Second World War. It tells the story of Charles Ryder's infatuation with the Marchmains and the rapidly-disappearing world of privilege they inhabit. Enchanted first by Sebastian at Oxford, then by his doomed Catholic family, in particular his remote sister, Julia, Charles comes finally to recognize only his spiritual and social distance from them.","['Fiction', 'Historical Fiction', 'Classics', 'Literature', 'Novels', 'British Literature', 'LGBT', '20th Century', 'Literary Fiction', 'Historical']"
The Heart Is a Lonely Hunter,https://www.goodreads.com/book/show/37380.The_Heart_Is_a_Lonely_Hunter,"Carson McCullers’ prodigious first novel was published to instant acclaim when she was just twenty-three. Set in a small town in the middle of the deep South, it is the story of John Singer, a lonely deaf-mute, and a disparate group of people who are drawn towards his kind, sympathetic nature. The owner of the café where Singer eats every day, a young girl desperate to grow up, an angry drunkard, a frustrated black doctor: each pours their heart out to Singer, their silent confidant, and he in turn changes their disenchanted lives in ways they could never imagine.","['Fiction', 'Classics', 'Literature', 'Novels', 'Historical Fiction', 'Literary Fiction', 'Southern Gothic', 'American', 'Southern', 'Coming Of Age']"
Cannery Row,https://www.goodreads.com/book/show/4799.Cannery_Row,"Cannery Row is a book without much of a plot. Rather, it is an attempt to capture the feeling and people of a place, the cannery district of Monterey, California, which is populated by a mix of those down on their luck and those who choose for other reasons not to live ""up the hill"" in the more respectable area of town. The flow of the main plot is frequently interrupted by short vignettes that introduce us to various denizens of the Row, most of whom are not directly connected with the central story. These vignettes are often characterized by direct or indirect reference to extreme violence: suicides, corpses, and the cruelty of the natural world.The ""story"" of follows the adventures of Mack and the boys, a group of unemployed yet resourceful men who inhabit a converted fish-meal shack on the edge of a vacant lot down on the Row.Sweet Thursday is the sequel to Cannery Row.","['Fiction', 'Classics', 'Literature', 'Historical Fiction', 'American', 'Novels', 'Literary Fiction', 'Classic Literature', '20th Century', 'The United States Of America']"
I Capture the Castle,https://www.goodreads.com/book/show/31122.I_Capture_the_Castle,"Through six turbulent months of 1934, 17-year-old Cassandra Mortmain keeps a journal, filling three notebooks with sharply funny yet poignant entries about her home, a ruined Suffolk castle, and her eccentric and penniless family. By the time the last diary shuts, there have been great changes in the Mortmain household, not the least of which is that Cassandra is deeply, hopelessly, in love.","['Classics', 'Fiction', 'Young Adult', 'Historical Fiction', 'Romance', 'Coming Of Age', 'Historical', 'British Literature', 'Audiobook', 'Novels']"
The Pearl,https://www.goodreads.com/book/show/5308.The_Pearl,"Like his father and grandfather before him, Kino is a poor diver, gathering pearls from the gulf beds that once brought great wealth to the kings of Spain and now provide Kino, Juana, and their infant son with meager subsistence. Then, on a day like any other, Kino emerges from the sea with a pearl as large as a sea gull’s egg, as “perfect as the moon.” With the pearl comes hope, the promise of comfort and of security…A story of classic simplicity, based on a Mexican folk tale, The Pearl explores the secrets of man’s nature, greed, the darkest depths of evil, and the luminous possibilities of love.","['Classics', 'Fiction', 'Literature', 'School', 'Historical Fiction', 'American', 'Novels', 'Read For School', 'Short Stories', 'Novella']"
"Cry, the Beloved Country",https://www.goodreads.com/book/show/6150.Cry_the_Beloved_Country,"Cry, the Beloved Country, the most famous and important novel in South Africa’s history, was an immediate worldwide bestseller in 1948. Alan Paton’s impassioned novel about a black man’s country under white man’s law is a work of searing beauty.Cry, the beloved country, for the unborn child that is the inheritor of our fear. Let him not love the earth too deeply. Let him not laugh too gladly when the water runs through his fingers, nor stand too silent when the setting sun makes red the veld with fire. Let him not be too moved when the birds of his land are singing, nor give too much of his heart to a mountain or valley. For fear will rob him of all if he gives too much.The eminent literary critic Lewis Gannett wrote, “We have had many novels from statesmen and reformers, almost all bad; many novels from poets, almost all thin. In Alan Paton’s the statesman, the poet and the novelist meet in a unique harmony.”is the deeply moving story of the Zulu pastor Stephen Kumalo and his son, Absalom, set against the background of a land and a people riven by racial injustice. Remarkable for its lyricism, unforgettable for character and incident, is a classic work of love and hope, courage and endurance, born of the dignity of man.","['Fiction', 'Classics', 'Historical Fiction', 'South Africa', 'Literature', 'School', 'Novels', 'Historical', 'High School', 'Read For School']"
Hiroshima,https://www.goodreads.com/book/show/27323.Hiroshima,"On August 6, 1945, Hiroshima was destroyed by the first atom bomb ever dropped on a city. This book, John Hersey's journalistic masterpiece, tells what happened on that day. Told through the memories of survivors, this timeless, powerful and compassionate document has become a classic ""that stirs the conscience of humanity"" (The New York Times).","['History', 'Nonfiction', 'War', 'Classics', 'Japan', 'World War II', 'Historical', 'Journalism', 'Asia', 'School']"
The Fountainhead,https://www.goodreads.com/book/show/2122.The_Fountainhead,"The revolutionary literary vision that sowed the seeds of Objectivism, Ayn Rand's groundbreaking philosophy, and brought her immediate worldwide acclaim.This modern classic is the story of intransigent young architect Howard Roark, whose integrity was as unyielding as granite...of Dominique Francon, the exquisitely beautiful woman who loved Roark passionately, but married his worst enemy...and of the fanatic denunciation unleashed by an enraged society against a great creator. As fresh today as it was then, Rand’s provocative novel presents one of the most challenging ideas in all of fiction—that man’s ego is the fountainhead of human progress...“A writer of great power. She has a subtle and ingenious mind and the capacity of writing brilliantly, beautifully, bitterly...This is the only novel of ideas written by an American woman that I can recall.”—The New York Times","['Fiction', 'Classics', 'Philosophy', 'Literature', 'Novels', 'Politics', 'Architecture', 'Literary Fiction', 'American', 'Classic Literature']"
The Glass Menagerie,https://www.goodreads.com/book/show/92517.The_Glass_Menagerie,"No play in the modern theater has so captured the imagination and heart of the American public as Tennessee Williams's The Glass Menagerie. As Williams's first popular success, it launched the brilliant, if somewhat controversial, career, of our pre-eminent lyric playwright. Since its premiere in Chicago in 1944, with the legendary Laurette Taylor in the role of Amanda, Menagaerie has been the bravura piece for great actresses from Jessica Tandy to Joanne Woodward, and is studied and performed in classrooms and theatres around the world.The Glass Menagerie (in the reading text the author preferred) is now available only in its New Directions Paperbook edition. A new introduction by the editor of The Tennessee Williams Annual Review, Robert Bray, reappraises the play more than half a century after it won the New York Drama Critics Circle Award. This edition of The Glass Menagerie also includes Williams's essay on the impact of sudden fame on a struggling writer, ""The Catastrophe of Success,"" as well as a short section of Williams's own ""Production Notes.""(back cover)","['Plays', 'Classics', 'Fiction', 'Drama', 'School', 'Theatre', 'Literature', 'Read For School', 'High School', 'American']"
Ficciones,https://www.goodreads.com/book/show/426504.Ficciones,"The seventeen pieces in Ficciones demonstrate the whirlwind of Borges's genius and mirror the precision and potency of his intellect and inventiveness, his piercing irony, his skepticism, and his obsession with fantasy. Borges sends us on a journey into a compelling, bizarre, and profoundly resonant realm; we enter the fearful sphere of Pascal's abyss, the surreal and literal labyrinth of books, and the iconography of eternal return. To enter the worlds in Ficciones is to enter the mind of Jorge Luis Borges, wherein lies Heaven, Hell, and everything else in between.Part One: The Garden of Forking PathsPrologueTlön, Uqbar, Orbis Tertius (1940)The Approach to Al-Mu'tasim (1936, not included in the 1941 edition)Pierre Menard, Author of the Quixote (1939)The Circular Ruins (1940)The Lottery in Babylon (1941)An Examination of the Work of Herbert Quain (1941)The Library of Babel (1941)The Garden of Forking Paths (1941)Part Two: ArtificesPrologueFunes the Memorious (1942)The Form of the Sword (1942)Theme of the Traitor and the Hero (1944)Death and the Compass (1942)The Secret Miracle (1943)Three Versions of Judas (1944)The End (1953, 2nd edition only)The Sect of the Phoenix (1952, 2nd edition only)The South (1953, 2nd edition only)","['Fiction', 'Short Stories', 'Magical Realism', 'Fantasy', 'Literature', 'Spanish Literature', 'Philosophy', 'Latin American', '20th Century', 'Classics']"
The Chronicles of Narnia,https://www.goodreads.com/book/show/11127.The_Chronicles_of_Narnia,"Librarian note: An alternate cover for this edition can be found here: 2005.Journeys to the end of the world, fantastic creatures, and epic battles between good and evil—what more could any reader ask for in one book? The book that has it all is The Lion, the Witch and the Wardrobe, written in 1949 by Clive Staples Lewis. But Lewis did not stop there. Six more books followed, and together they became known as The Chronicles of Narnia.For the past fifty years, have transcended the fantasy genre to become part of the canon of classic literature. Each of the seven books is a masterpiece, drawing the reader into a land where magic meets reality, and the result is a fictional world whose scope has fascinated generations.This edition presents all seven books—unabridged—in one impressive volume. The books are presented here in chronlogical order, each chapter graced with an illustration by the original artist, Pauline Baynes. Deceptively simple and direct, continue to captivate fans with adventures, characters, and truths that speak to readers of all ages, even fifty years after they were first published.","['Fantasy', 'Classics', 'Fiction', 'Young Adult', 'Childrens', 'Christian', 'Middle Grade', 'Christian Fiction', 'Science Fiction Fantasy', 'Magic']"
Make Way for Ducklings,https://www.goodreads.com/book/show/29291.Make_Way_for_Ducklings,"This classic tale of the famous Mallard ducks of Boston is available for the first time in a full-sized paperback edition. Awarded the Caldecott Medal in 1942, Make Way for Ducklings has been described as ""one of the merriest picture books ever"" (The New York Times). Ideal for reading aloud, this book deserves a place of honor on every child's bookshelf.","['Picture Books', 'Childrens', 'Classics', 'Fiction', 'Animals', 'Family', 'Juvenile', 'Kids', 'Birds', 'Adventure']"
