title,url,description,genres
The Great Transformation: The Political and Economic Origins of Our Time,https://www.goodreads.com/book/show/53981.The_Great_Transformation,"In this classic work of economic history and social theory, Karl Polanyi analyzes the economic and social changes brought about by the ""great transformation"" of the Industrial Revolution. His analysis explains not only the deficiencies of the self-regulating market, but the potentially dire social consequences of untempered market capitalism. New introductory material reveals the renewed importance of Polanyi's seminal analysis in an era of globalization and free trade.","['Economics', 'History', 'Politics', 'Nonfiction', 'Sociology', 'Philosophy', 'International Relations', 'Anthropology', 'Political Science', 'Academic']"
All About H. Hatterr,https://www.goodreads.com/book/show/1252537.All_About_H_Hatterr,"All About H. Hatterr (1948) is a classic novel by G. V. Desani chronicling the adventures of an Anglo-Malay man in search of wisdom and enlightenment. ""As far back as in 1951,"" Desani later wrote, ""I said H. Hatterr was a portrait of a man, the common vulgar species, found everywhere, both in the East and in the West"". Salman Rushdie comments[1]: “ The writer I have placed alongside Narayan, G.V. Desani, has fallen so far from favour that the extraordinary All About H. Hatterr is presently out of print everywhere, even in India. Milan Kundera once said that all modern literature descends from either Richardson's Clarissa or Sterne's Tristram Shandy, and if Narayan is India's Richardson then Desani is his Shandean other. Hatterr's dazzling, puzzling, leaping prose is the first genuine effort to go beyond the Englishness of the English language. His central figure, 'fifty-fifty of the species,' the half-breed as unabashed anti-hero, leaps and capers behind many of the texts in this book. Hard to imagine I. Allan Sealy's Trotter-Nama without Desani. My own writing, too, learned a trick or two from him.","['Fiction', 'India', 'Indian Literature', 'Classics', 'Humor', 'Literature', 'Asia', '20th Century', 'Novels', 'Kenya']"
Half a Lifelong Romance,https://www.goodreads.com/book/show/25937741-half-a-lifelong-romance,"""Shanghai, 1930s. Shen Shijun, a young engineer, has fallen in love with his colleague, the beautiful Gu Manzhen. He is determined to resist his family's efforts to match him with his wealthy cousin so that he can marry the woman he truly loves. But dark circumstances--a lustful brother-in-law, a treacherous sister, a family secret--force the two young lovers apart. As Manzhen and Shijun go on their separate paths, they lose track of one another, and their lives become filled with feints and schemes, missed connections and tragic misunderstandings. At every turn, societal expectations seem to thwart their prospects for happiness. Still, Manzhen and Shijun dare to hold out hope--however slim--that they might one day meet again. A glamorous, wrenching tale set against the glittering backdrop of an extraordinary city, Half a Lifelong Romance is a beloved classic from one of the essential writers of twentieth-century China""--","['Fiction', 'China', 'Historical Fiction', 'Romance', 'Classics', 'Asia', 'Chinese Literature', 'Asian Literature', 'Literature', 'Historical']"
The Idea of History,https://www.goodreads.com/book/show/348305.The_Idea_of_History,"The Idea of History is the best-known work of the great Oxford philosopher, historian, and archaeologist R.G. Collingwood. It was originally published posthumously in 1946, having been mainly reconstructed from Collingwood's manuscripts, many of which are now lost. This important work examines how the idea of history has evolved from the time of Herodotus to the twentieth century, and offers Collingwood's own view of what history is. For this revised edition, Collingwood's most important lectures on the philosophy of history are published here for the first time. These texts have been prepared by Jan van der Dussen from manuscripts that have only recently become available. The lectures contain Collingwood's first comprehensive statement of his philosophy of history; they are therefore essential for a full understanding of his thought, and in particular for a correct interpretation of The Idea of History itself. Van der Dussen contributes a substantial introduction in which heexplains the background to this new edition and surveys the scholarship of the last fifty years.","['History', 'Philosophy', 'Nonfiction', 'Academic', 'Theory', 'World History', 'Essays', 'Anthropology', 'Historical', 'Read For School']"
My Friend Flicka,https://www.goodreads.com/book/show/164542.My_Friend_Flicka,"It seems Ken can't do anything right. He loses saddle blankets and breaks reins...but then comes the worst news yet: a report card so bad that he has to repeat a grade. How can you tame the dreamy mind of a boy who stares out of the window instead of taking an exam? Enter Flicka, the chestnut filly with a wild spirit.Over the course of one magical summer, both will learn the meaning of responsibility, courage, and, ultimately, friendship.","['Classics', 'Horses', 'Fiction', 'Animals', 'Young Adult', 'Childrens', 'Middle Grade', 'Historical Fiction', 'Juvenile', 'Banned Books']"
The Case of Charles Dexter Ward,https://www.goodreads.com/book/show/129327.The_Case_of_Charles_Dexter_Ward,"Incantations of black magic unearthed unspeakable horrors in Providence, Rhode Island. Evil spirits are being resurrected from beyond the grave, a supernatural force so twisted that it kills without offering the mercy of death!","['Horror', 'Fiction', 'Classics', 'Fantasy', 'Lovecraftian', 'Mystery', 'Science Fiction', 'Short Stories', 'Gothic', 'Weird Fiction']"
Dragon's Teeth,https://www.goodreads.com/book/show/39078166-dragon-s-teeth,"Pulitzer Prize Winner: An American in Germany fights against the rising tide of Nazi terror in this monumental saga of twentieth-century world history.In the wake of the 1929 stock market crash, Lanny Budd’s financial acumen and his marriage into great wealth enable him to continue the lifestyle he has always enjoyed.  But the devastation the collapse has wrought on ordinary citizens has only strengthened Lanny’s socialist ideals—much to the chagrin of his heiress wife, Irma, a confirmed capitalist. In Germany to visit relatives, Lanny encounters a disturbing atmosphere of hatred and jingoism. His concern over the growing popularity of the Nazi Party escalates when he meets Adolf Hitler, the group’s fanatical leader, and the members of his inner circle. But Lanny’s gravest fear is the threat a national socialist government poses to the German Jewish family of Hansi, the musician husband of Lanny’s sister, Bess—a threat that will impel the international art dealer to risk his wealth, his future, even his life in a courageous attempt to rescue his loved ones from a terrible fate. Winner of the 1943 Pulitzer Prize for Fiction, Dragon’s Teeth brilliantly captures the nightmarish march toward the Second World War. An astonishing mix of history, adventure, and romance, the Lanny Budd Novels are a testament to the breathtaking scope of Upton Sinclair’s vision and his singular talents as a storyteller.","['Fiction', 'Historical Fiction', 'Classics', 'War', 'World War II', 'Novels', 'Literature', 'Literary Fiction', 'Politics', 'American']"
No Bed for Bacon,https://www.goodreads.com/book/show/749399.No_Bed_for_Bacon,"Shakespeare's in love, perchance, in this rollicking send-up of the Age of Elizabeth. With an Introduction by Ned Sherrin.","['Fiction', 'Historical Fiction', 'Humor', 'Comedy', 'Classics', 'British Literature', 'Historical', 'Books About Books', 'Novels']"
Mary Poppins Opens the Door,https://www.goodreads.com/book/show/152383.Mary_Poppins_Opens_the_Door,"Another timeless story about Mary Poppins, the world s most exciting nanny, and her magical adventures with the Banks familyFrom the moment Mary Poppins arrives at Number Seventeen Cherry Tree Lane, everyday life at the Banks house is forever changed. Jane, Michael, and the twins have never had such a wonderful nanny, who brings enchantment and excitement everywhere she goes.In ""Mary Poppins Opens the Door,"" Mary Poppins reappears just in time! According to her tape measure, Jane and Michael have grown Worse and Worse since she went away. But the children won t have time to be naughty with all that Mary has planned for them. A visit to Mr. Twigley s music box filled attic, an encounter with the Marble Boy, and a ride on Miss Calico s enchanted candy canes are all part of an average day out with everyone s favorite nanny.","['Classics', 'Fantasy', 'Childrens', 'Fiction', 'Middle Grade', 'Young Adult', 'Audiobook', 'Magic', 'Juvenile', 'British Literature']"
The Woman of Rome,https://www.goodreads.com/book/show/67147.The_Woman_of_Rome,"The glitter and cynicism of Rome under Mussolini provide the background of what is probably Alberto Moravia’s best and best-known novel — The Woman of Rome. It’s the story of Adriana, a simple girl with no fortune but her beauty who models naked for a painter, accepts gifts from men, and could never quite identify the moment when she traded her private dream of home and children for the life of a prostitute.One of the very few novels of the twentieth century which can be ranked with the work of Dostoevsky, also tells the stories of the tortured university student Giacomo, a failed revolutionary who refuses to admit his love for Adriana; of the sinister figure of Astarita, the Secret Police officer obsessed with Adriana; and of the coarse and brutal criminal Sonzogno, who treats Adriana as his private property. Within this story of passion and betrayal, Moravia calmly strips away the pride and arrogance hiding the corrupt heart of Italian Fascism.","['Fiction', 'Italy', 'Italian Literature', 'Classics', 'Novels', 'Literature', '20th Century', 'Drama', 'Contemporary', 'Literary Fiction']"
Arcanum 17,https://www.goodreads.com/book/show/168311.Arcanum_17,"André Breton wrote Arcanum 17 during a trip to the Gaspé Peninsula in Quebec in the months after D-Day in 1944, when the Allied troops were liberating Occupied Europe. Using the huge Percé Rock—its impermanence, its slow-motion crumbling, its singular beauty—as his central metaphor, Breton considers love and loss, aggression and war, pacifism, feminism and the occult, in a book that is part prose and part poetry, part reality and part dream. In the 17th card in the Major Arcana of the Tarot deck, a naked woman beneath a sky of stars pours water from two urns into water and onto land. This card represents hope, renewal and resurrection—the themes that permeate Arcanum 17 . Considered radical at the time, Breton’s ideas today seem almost prescient, yet still breathtaking in their passionate underlying belief in the indestructibility of life and the freedom of the human spirit.Translator Zack Rogow shared the 1993 PEN/Book-of-the-Month Club Translation Prize for Earthlight by André Breton. His translation of George Sand’s Horace won the Bay Area Book Reviewers’ Association Award. He currently coordinates the Lunch Poems Reading Series at the University of California at Berkeley and teaches at the California College of the Arts.","['Fiction', 'Poetry', 'Philosophy', 'France', 'French Literature', 'Classics', 'Literature', '20th Century', 'World War II', 'Literary Fiction']"
Blood on the Forge,https://www.goodreads.com/book/show/261497.Blood_on_the_Forge,"This brutally gripping novel about the African-American Great Migration follows the three Moss brothers, who flee the rural South to work in industries up North. Delivered by day into the searing inferno of the steel mills, by night they encounter a world of surreal devastation, crowded with dogfighters, whores, cripples, strikers, and scabs. Keenly sensitive to character, prophetic in its depiction of environmental degradation and globalized labor, Attaway's novel is an unprecedented confrontation with the realities of American life, offering an apocalyptic vision of the melting pot not as an icon of hope but as an instrument of destruction. was first published in 1941, when it attracted the admiring attention of Richard Wright and Ralph Ellison. It is an indispensable account of a major turning point in black history, as well as a triumph of individual style, charged with the concentrated power and poignance of the blues.","['Fiction', 'Historical Fiction', 'African American', 'Literary Fiction', 'Literature', 'Classics', 'Novels', 'American', 'Americana', 'Race']"
The Log from the Sea of Cortez,https://www.goodreads.com/book/show/4803.The_Log_from_the_Sea_of_Cortez,"An alternate edition can be found here.In 1940 Steinbeck sailed in a sardine boat with his great friend the marine biologist, Ed Ricketts, to collect marine invertebrates from the beaches of the Gulf of California. The expedition was described by the two men in Sea of Cortez, published in 1941. The day-to-day story of the trip is told here in the Log, which combines science, philosophy and high-spirited adventure.includes the narrative of the journey and the essay “About Ed Ricketts.” It does not include pictures and detailed descriptions of the species collected by Steinbeck and Ricketts. (See also .)","['Nonfiction', 'Classics', 'Travel', 'Science', 'Nature', 'Memoir', 'Biography', 'Literature', 'Adventure', 'Natural History']"
The Complete Stories,https://www.goodreads.com/book/show/22904.The_Complete_Stories,"The Complete Stories brings together all of Kafka’s stories, from the classic tales such as “The Metamorphosis,” “In the Penal Colony,” and “A Hunger Artist” to shorter pieces and fragments that Max Brod, Kafka’s literary executor, released after Kafka’s death. With the exception of his three novels, the whole of Kafka’s narrative work is included in this volume.--penguinrandomhouse.comTwo Introductory parables: Before the law --Imperial message --Longer stories: Description of a struggle --Wedding preparations in the country --Judgment --Metamorphosis --In the penal colony --Village schoolmaster (The giant mole) --Blumfeld, and elderly bachelor --Warden of the tomb --Country doctor --Hunter Gracchus --Hunter Gracchus: A fragment --Great Wall of China --News of the building of the wall: A fragment --Report to an academy --Report to an academy: Two fragments --Refusal --Hunger artist --Investigations of a dog --Little woman --The burrow --Josephine the singer, or the mouse folk --Children on a country road --The trees --Clothes --Excursion into the mountains --Rejection --The street window --The tradesman --Absent-minded window-gazing --The way home --Passers-by --On the tram --Reflections for gentlemen-jockeys --The wish to be a red Indian --Unhappiness --Bachelor's ill luck --Unmasking a confidence trickster --The sudden walk --Resolutions --A dream --Up in the gallery --A fratricide --The next village --A visit to a mine --Jackals and Arabs --The bridge --The bucket rider --The new advocate --An old manuscript --The knock at the manor gate --Eleven sons --My neighbor --A crossbreed (A sport) --The cares of a family man --A common confusion --The truth about Sancho Panza --The silence of the sirens --Prometheus --The city coat of arms --Poseidon --Fellowship --At night --The problem of our laws --The conscripton of troops --The test --The vulture --The helmsman --The top --A little fable --Home-coming --First sorrow --The departure --Advocates --The married couple --Give it up! --On parables.","['Short Stories', 'Fantasy', 'Literary Fiction', 'Magical Realism', 'Classic Literature', 'Short Story Collection', 'Fiction']"
The Human Comedy,https://www.goodreads.com/book/show/28305.The_Human_Comedy,"The place is Ithaca, in California's San Joaquin Valley. The time is World War II. The family is the Macauleys -- a mother, sister, and three brothers whose struggles and dreams reflect those of America's second-generation immigrants.. In particular, fourteen-year-old Homer, determined to become one of the fastest telegraph messengers in the West, finds himself caught between reality and illusion as delivering his messages of wartime death, love, and money brings him face-to-face with human emotion at its most naked and raw.Gentle, poignant and richly autobiographical, this delightful novel shows us the boy becoming the man in a world that even in the midst of war, appears sweeter, safer and more livable than out own.","['Fiction', 'Classics', 'Historical Fiction', 'Novels', 'Literature', 'American', 'Young Adult', 'Coming Of Age', 'War', 'World War II']"
Focus,https://www.goodreads.com/book/show/850116.Focus,"Written in 1945, Focus was Arthur Miller's first novel and one of the first books to directly confront American anti-Semitism. It remains as chilling and incisive today as it was at the time of its controversial debut. As World War II draws to a close, anti-Semitism is alive and well in Brooklyn, New York. Here, Newman, an American of English descent, floats through a world of multiethnic neighborhoods indifferent to the racism around him. That is, until he begins wearing glasses that render him ""Jewish"" in the eyes of others, making him the target of anti-Semitic persecution. As he and his wife find friendship and support from a Jewish immigrant, Newman slowly begins to understand the racial hatreds that surround him.""A strong, sincere book bursting with indignation."" ()","['Fiction', 'Classics', 'American', 'Plays', 'Novels', 'The United States Of America', 'Literature', 'Jewish', 'Literary Fiction', 'Historical Fiction']"
Lark Rise to Candleford,https://www.goodreads.com/book/show/1744691.Lark_Rise_to_Candleford,"This is an alternate cover edition for ISBN 0140036725.The story of three closely related Oxfordshire communities - a hamlet, the nearby village and a small market town - this immortal trilogy is based on Flora Thompson's experiences during childhood and youth. It chronicles May Day celebrations and forgotten children's games, the daily lives of farmworkers and craftsmen, friends and relations - all painted with the gaiety and freshness of observation that makes this a precise and endearing portrayal of country life at the end of the last century.","['Classics', 'Fiction', 'Historical Fiction', 'Historical', 'British Literature', '19th Century', 'Novels', 'Literature', 'Modern Classics', '20th Century']"
Names on the Land: A Historical Account of Place-Naming in the United States,https://www.goodreads.com/book/show/2376121.Names_on_the_Land,"This beloved classic about place-naming in the United States was written during World War II in a conscious effort to pay tribute to the heritage of the nation's peoples. George R. Stewart's love of the surprising story, and his focus not just on language but on how people interact with their environment, make Names on the Land a unique window into the history and sociology of America.From the first European names in what would later be the United States; Ponce de León's flowery Florída, Cortez' semi-mythical isle of California, and the red river Rio Colorado; to New England, New Amsterdam, and New Sweden; the French and the Russians; border ruffians and Boston Brahmins: is no dry dictionary but a fascinating panorama of language in action, bursting at the seams with revealing details. In lively, passionate writing, Stewart explains where Indian names were likely to be kept, and why; the fad that gave rise to dozens of Troys and to Athens, Georgia, as well as suburban Parksides, Brookmonts, and Woodcrest Manors; why ""Brooklyn"" is Dutch but looks English and why ""Arkansas"" is Arkansaw, except of course when it isn't.His book has delighted generations of road-trippers, armchair travelers, and anyone who ever wondered how their hometown, or (more likely) the next town over, could be called Stewart's answer is always a story; one of the countless stories that lie behind the rich and strange diversity of America.","['History', 'Nonfiction', 'Geography', 'American History', 'Language', 'Travel', 'American', 'Reference', 'The United States Of America', 'Cartography']"
Bosnian Chronicle,https://www.goodreads.com/book/show/850223.Bosnian_Chronicle,"Set in the town of Travnik, Bosnian Chronicle presents the struggle for supremacy in a region that stubbornly refuses to submit to any outsider. The era is Napoleanic and the novel, both in its historical scope and psychological subtley, Tolstoyan. In its portray of conflict and fierce ethnic loyalties, the story is also eerily relevant. Ottoman viziers, French consuls, and Austrian plenipotentiaries are consumed by an endless game of diplomacy and double-dealing: expansive and courtly face-to-face, brooding and scheming behind closed doors. As they have for centuries, the Bosnians themselves observe and endure the machinations of greater powers that vie, futilely, to absorb them. Ivo Andric's masterwork is imbued with the richness and complexity of a region that has brought so much tragedy to our century and known so little peace.","['Fiction', 'Historical Fiction', 'Classics', 'Nobel Prize', 'Literature', 'Historical', 'Novels']"
Raintree County,https://www.goodreads.com/book/show/6921122-raintree-county,"In 1948, three young authors published first novels that indelibly changed the landscape of American letters...THE NAKED AND THE DEAD by Norman Mailer, THE YOUNG LIONS by Irwin Shaw and RAINTREE COUNTY by Ross Lockridge, Jr. Whereas Mailer and Shaw went on to write many other novels, Lockridge died by his own hand at the age of 34 in that same fateful year.This panoramic epic of the 19th century in Raintree County, Indiana (particularly of the Civil War and its effects), was produced after six years of research, writing and revision. It continues to command attention and respect as a stylistically unique work of considerable force.","['Fiction', 'Historical Fiction', 'Classics', 'Novels', 'Civil War', 'Romance', 'War', 'Historical', 'Literary Fiction', 'American']"
Silverlock,https://www.goodreads.com/book/show/104069.Silverlock,"Join an unlikely hero as he watches Moby-Dick sink the Pequod, dodges cannibals on Robinson Crusoe's island, raises a glass with Beowulf, and literally goes to Hell and back.This rollicking adventure begins with a shipwreck on an island where notable characters of literature, history, and folklore coexist — Hamlet and Oedipus, Don Quixote and Doctor Faustus, Becky Sharp and Daniel Boone. From carousing with Robin Hood to crossing swords with the Green Knight and stealing a ride on Huck Finn's raft, our traveler, A. Clarence Shandon, undertakes a whirlwind tour of the classics.And just as the truths of great stories ennoble those who take them to heart, a selfish and cynical drifter is transformed into the gallant knight known as Silverlock.","['Fantasy', 'Fiction', 'Classics', 'Adventure', 'Science Fiction Fantasy', 'Mythology', 'Humor', 'Science Fiction', 'Collections', 'Literature']"
If He Hollers Let Him Go,https://www.goodreads.com/book/show/52472.If_He_Hollers_Let_Him_Go,"This story of a man living every day in fear of his life for simply being black is as powerful today as it was when it was first published in 1947. The novel takes place in the space of four days in the life of Bob Jones, a black man who is constantly plagued by the effects of racism. Living in a society that is drenched in race consciousness has no doubt taken a toll on the way Jones behaves, thinks, and feels, especially when, at the end of his story, he is accused of a brutal crime he did not commit. ""One of the most important American writers of the twentieth century ... [a] quirky American genius...""—Walter Mosley, author of Bad Boy Brawly Brown, Devil in a Blue Dress ""If He Hollers is an austere and concentrated study of black experience, set in southern California in the early forties.""—Independent Publisher","['Fiction', 'African American', 'Classics', 'Race', 'Mystery', 'Novels', 'Noir', 'Crime', 'Literature', '20th Century']"
The Path to the Spiders' Nests,https://www.goodreads.com/book/show/60111.The_Path_to_the_Spiders_Nests,"Italo Calvino was only twenty-three when he first published this bold and imaginative novel. It tells the story of Pin, a cobbler's apprentice in a town on the Ligurian coast during World War II. He lives with his sister, a prostitute, and spends as much time as he can at a seedy bar where he amuses the adult patrons. After a mishap with a Nazi soldier, Pin becomes involved with a band of partisans. Calvino's portrayal of these characters, seen through the eyes of a child, is not only a revealing commentary on the Italian resistance but an insightful coming-of-age story.Updated to include changes from Calvino's definitive Italian edition, previously censored passages, and his newly translated, unabridged preface, in which Calvino brilliantly critiques and places into historical context his own youthful work.is animated by the formidable imagination that has made Italo Calvino one of the most respected writers of our time.","['Fiction', 'Classics', 'Italian Literature', 'Italy', 'Historical Fiction', 'Novels', 'War', 'School', 'Literature', 'World War II']"
The Prime of Life: The Second Volume of Her Autobiography,https://www.goodreads.com/book/show/381055.The_Prime_of_Life,"The second volume in Simone de Beauvoir's autobiography. In it she continues the story of her life from the age of 21, through the uneasy rebellious 30s, the war years and finally to the liberation of Paris in 1944.","['Nonfiction', 'Biography', 'Memoir', 'Philosophy', 'France', 'Autobiography', 'Feminism', 'Classics', 'Womens', 'French Literature']"
