title,url,description,genres
Put Out More Flags,https://www.goodreads.com/book/show/105187.Put_Out_More_Flags,"Upper-class scoundrel Basil Seal, mad, bad, and dangerous to know, creates havoc wherever he goes, much to the despair of the three women in his life-his sister, his mother, and his mistress. When Neville Chamberlain declares war on Germany, it seems the perfect opportunity for more action and adventure. So Basil follows the call to arms and sets forth to enjoy his finest hour-as a war hero. Basil's instincts for self-preservation come to the fore as he insinuates himself into the Ministry of Information and a little-known section of Military Security. With Europe frozen in the ""phoney war,"" when will Basil's big chance to fight finally arrive?","['Fiction', 'Classics', 'Humor', 'Literature', 'War', 'British Literature', 'World War II', 'Historical Fiction', '20th Century', 'Novels']"
Midaq Alley,https://www.goodreads.com/book/show/5499.Midaq_Alley,"Never has Nobel Prize-winner Naguib Mahfouz's talent for rich and luxurious storytelling been more evident than in Midaq Alley, which centers around the residents of one of the hustling, teeming back alleys of Cairo. From Zaita the cripple-maker to Kirsha the café owner with a taste for young boys and drugs, to Abbas the barber who mistakes greed for love, to Hamida who sells her soul to escape the alley, these characters vividly evoke the sights, sounds and smells of Cairo. Long after one finishes reading, the smell of fresh bread lingers, as does the image of the men gathering at the café for their nightly ritual. The universality and timelessness of this book cannot be denied.","['Fiction', 'Egypt', 'Novels', 'Classics', 'Literature', 'Africa', 'Nobel Prize', 'Historical Fiction', 'School', '20th Century']"
The American Political Tradition and the Men Who Made It,https://www.goodreads.com/book/show/773961.The_American_Political_Tradition_and_the_Men_Who_Made_It,"The American Political Tradition is one of the most influential and widely read historical volumes of our time. First published in 1948, its elegance, passion, and iconoclastic erudition laid the groundwork for a totally new understanding of the American past. By writing a ""kind of intellectual history of the assumptions behind American politics,"" Richard Hofstadter changed the way Americans understand the relationship between power and ideas in their national experience. Like only a handful of American historians before him—Frederick Jackson Turner and Charles A. Beard are examples—Hofstadter was able to articulate, in a single work, a historical vision that inspired and shaped an entire generation.","['History', 'Politics', 'Nonfiction', 'American History', 'Political Science', 'Biography', 'American', 'Philosophy', 'United States', 'Essays']"
Nada,https://www.goodreads.com/book/show/62779.Nada,"Carmen Laforet’s Nada ranks among the most important literary works of post-Civil War Spain. Loosely based on the author’s own life, it is the story of an orphaned young woman who leaves her small town to attend university in war-ravaged Barcelona.Residing amid genteel poverty in a mysterious house on Calle de Aribau, young Andrea falls in with a wealthy band of schoolmates who provide a rich counterpoint to the squalor of her home life. As experience overtakes innocence, Andrea gradually learns the disquieting truth about the people she shares her life with: her overbearing and superstitious aunt Angustias; her nihilistic yet artistically gifted uncle Román and his violent brother Juan; and Juan’s disturbingly beautiful wife, Gloria, who secretly supports the clan with her gambling. From existential crisis to a growing maturity and resolve, Andrea’s passionate inner journey leaves her wiser, stronger, and filled with hope for the future.The incomparable Edith Grossman’s vital new translation captures the feverish energy of Laforet’s magnificent story, showcasing its dark, powerful imagery, and its subtle humor. And Mario Vargas Llosa’s Introduction illuminates Laforet’s brilliant depiction of life during the early days of the Franco regime. With crystalline insight into the human condition, Carmen Laforet’s classic novel stands poised to reclaim its place as one of the great novels of twentieth-century Europe.","['Fiction', 'Classics', 'Spanish Literature', 'Spain', 'Historical Fiction', 'Womens', '20th Century', 'Novels', 'School', 'Drama']"
The Tunnel,https://www.goodreads.com/book/show/9574908-the-tunnel,"An unforgettable psychological novel of obsessive love, The Tunnel was championed by Albert Camus, Thomas Mann, and Graham Greene upon its publication in 1948 and went on to become an international bestseller. At its center is an artist named Juan Pablo Castel, who recounts from his prison cell his murder of a woman named María Iribarne. Obsessed from the moment he sees her examining one of his paintings, Castel fantasizes for months about how they might meet again. When he happens upon her one day, a relationship develops that convinces him of their mutual love. But Castel's growing paranoia leads him to destroy the one thing he truly cares about.","['Fiction', 'Classics', 'Spanish Literature', 'Literature', 'Novels', 'Latin American', 'Latin American Literature', 'Thriller', 'School', '20th Century']"
Scuffy the Tugboat,https://www.goodreads.com/book/show/914982.Scuffy_the_Tugboat,"""This is the place for a red-painted tugboat,"" says Scuffy. ""And this is the life for me.""This is the story of a toy tugboat and his big dream to be somewhere other than the toy store. Meant for ""bigger things,"" Scuffy the Tugboat sets off to explore the world. But on his daring adventure Scuffy realizes that home is where he'd rather be, sailing in his bathtub.For over 50 years, parents and children alike have cherished this classic making it a perennial staple among bedtime stories for generations of readers.","['Childrens', 'Picture Books', 'Fiction', 'Classics', 'Adventure', 'Fantasy', 'Kids', 'Juvenile', 'Transport', 'Young Adult']"
The Hollow,https://www.goodreads.com/book/show/16303.The_Hollow,"Lady Angkatell, intrigued by the criminal mind, has invited Hercule Poirot to her estate for a weekend house party. The Belgian detective's arrival at the Hollow is met with an elaborate tableau staged for his amusement: a doctor lies in a puddle of red paint, his timid wife stands over his body with a gun while the other guests look suitably shocked. But this is no charade. The paint is blood and the corpse real!","['Mystery', 'Fiction', 'Crime', 'Classics', 'Detective', 'Mystery Thriller', 'Audiobook', 'Murder Mystery', 'British Literature', 'Adult']"
The Children of Noisy Village,https://www.goodreads.com/book/show/19311.The_Children_of_Noisy_Village,"Welcome to Noisy Village! Go crayfishing in the summer at Nocken, ""dipping in the pot"" at Christmastime with Lisa and Karl, and join Britta and Anna who know the best way to go about ""nutting"" for the New Year. In this gently humorous tale, master storyteller Astrid Lindgren takes us through a year in the lives and customs of six Swedish children living on a group of three farms in the countryside.","['Childrens', 'Classics', 'Fiction', 'Swedish Literature', 'Sweden', 'Middle Grade', 'Scandinavian Literature', 'Historical Fiction', 'Chapter Books', 'German Literature']"
Black Lamb and Grey Falcon,https://www.goodreads.com/book/show/12880.Black_Lamb_and_Grey_Falcon,"Written on the brink of World War II, Rebecca West's classic examination of the history, people, and politics of Yugoslavia illuminates a region that is still a focus of international concern. A magnificent blend of travel journal, cultural commentary, and historical insight, Black Lamb and Grey Falcon probes the troubled history of the Balkans, and the uneasy relationships amongst its ethnic groups. The landscape and the people of Yugoslavia are brilliantly observed as West untangles the tensions that rule the country's history as well as its daily life.","['History', 'Travel', 'Nonfiction', 'Classics', 'Politics', 'Memoir', 'European History', 'Biography', '20th Century', 'Historical']"
The Open Society and Its Enemies,https://www.goodreads.com/book/show/240592.The_Open_Society_and_Its_Enemies,"Written in political exile in New Zealand during the Second World War and published in two volumes in 1945, The Open Society and its Enemies was hailed by Bertrand Russell as a 'vigorous and profound defence of democracy'. This legendary attack on the philosophies of Plato, Hegel and Marx prophesied the collapse of communism in Eastern Europe and exposed the fatal flaws of socially engineered political systems. It remains highly readable, erudite and lucid and as essential reading today as on publication in 1945. It is available here in a special centenary single-volume edition.","['Philosophy', 'Politics', 'Nonfiction', 'History', 'Sociology', 'Science', 'Society', 'Political Science', 'Classics', 'Economics']"
The Crab with the Golden Claws,https://www.goodreads.com/book/show/165555.The_Crab_with_the_Golden_Claws,"One of the most iconic characters in children’s booksHergé’s classic comic book creation Tintin is one of the most iconic characters in children’s books. These highly collectible editions of the original 24 adventures will delight Tintin fans old and new. Perfect for lovers of graphic novels, mysteries and historical adventures.The world’s most famous travelling reporter must handle the heat of the Sahara … and the company of a new friend.Faced with a drowned sailor, counterfeit coins and a ship full of opium, Tintin sets out on another adventure. Aboard the Karaboudjan Tintin is introduced to Captain Haddock for the first time, and they are soon both facing a deathly thirst in the Sahara desert.Join the most iconic character in comics as he embarks on an extraordinary adventure spanning historical and political events, and thrilling mysteries. Still selling over 100,000 copies every year in the UK and having been adapted for the silver screen by Steven Spielberg and Peter Jackson in 2011.The Adventures of Tintin continue to charm more than 80 years after they first found their way into publication. Since then an estimated 230 million copies have been sold, proving that comic books have the same power to entertain children and adults in the 21st century as they did in the early 20th.Hergé (Georges Remi) was born in Brussels in 1907. Over the course of 54 years he completed over 20 titles in The Adventures of Tintin series, which is now considered to be one of the greatest, if not the greatest, comics series of all time. Have you collected all the graphic novel adventures?Tintin in the Land of the SovietsTintin in AmericaTintin: Cigars of the PharaohTintin: The Blue LotusTintin: The Broken EarTintin: The Black IslandTintin: King Ottakar’s SceptreTintin: The Crab with the Golden ClawsTintin: The Shooting StarTintin: The Secret of the UnicornTintin: Red Rackham’s TreasureTintin: The Seven Crystal BallsTintin: Prisoners of the SunTintin: Land of Black GoldTintin: Destination MoonTintin: Explorers of the MoonTintin: The Calculus AffairTintin: The Red Sea SharksTintin in TibetTintin: The Castafiore EmeraldTintin: Flight 714 to SydneyThe Adventures of Tintin and the PicarosTintin and Alph-Art","['Comics', 'Graphic Novels', 'Bande Dessinée', 'Adventure', 'Fiction', 'Childrens', 'Graphic Novels Comics', 'Comic Book', 'France', 'Classics']"
Snow Treasure,https://www.goodreads.com/book/show/3019406-snow-treasure,"It is a dangerous plan. Every boy and girl in the little Norwegian village of Riswyk knows that! Now every sled ride can be a matter of life or death.Can the gold be saved from the Nazi troops the have parachuted into Norway? Can nine million dollars worth of gold be taken secretly to Uncle Victor's ship—and sent to America for safe keeping?""Your country needs your help,"" Uncle Victor tells Peter Lundstrom and his friends. The boys and girls of Riswyk do not hesitate.Under the sharp eyes and bristling guns of Nazi sentries, they begin the daring rescue of the hidden gold.A thrilling tale of wartime courage the","['Historical Fiction', 'Fiction', 'Childrens', 'World War II', 'Middle Grade', 'Adventure', 'Historical', 'Young Adult', 'Juvenile', 'School']"
Between the Acts,https://www.goodreads.com/book/show/46105.Between_the_Acts,"In Woolf's last novel, the action takes place on one summer's day at a country house in the heart of England, where the villagers are presenting their annual pageant. A lyrical, moving valedictory.","['Classics', 'Fiction', 'Literature', '20th Century', 'Novels', 'British Literature', 'Literary Fiction', 'English Literature', 'Female Authors', 'Modern Classics']"
Prisoners of the Sun,https://www.goodreads.com/book/show/96428.Prisoners_of_the_Sun,"One of the most iconic characters in children’s booksHergé’s classic comic book creation Tintin is one of the most iconic characters in children’s books. These highly collectible editions of the original 24 adventures will delight Tintin fans old and new. Perfect for lovers of graphic novels, mysteries and historical adventures.The world’s most famous travelling reporter journeys to South America on a mission to save Professor Calculus.When Professor Calculus is kidnapped, Tintin and a desperate Captain Haddock set off to Peru on a rescue mission, braving runaway train carriages, yellow fever and avalanches. Then they must find an ancient Inca tribe if they are to find their great friend.Join the most iconic character in comics as he embarks on an extraordinary adventure spanning historical and political events, and thrilling mysteries. Still selling over 100,000 copies every year in the UK and having been adapted for the silver screen by Steven Spielberg and Peter Jackson in 2011.The Adventures of Tintin continue to charm more than 80 years after they first found their way into publication. Since then an estimated 230 million copies have been sold, proving that comic books have the same power to entertain children and adults in the 21st century as they did in the early 20th.Hergé (Georges Remi) was born in Brussels in 1907. Over the course of 54 years he completed over 20 titles in The Adventures of Tintin series, which is now considered to be one of the greatest, if not the greatest, comics series of all time. Have you collected all the graphic novel adventures?Tintin in the Land of the SovietsTintin in AmericaTintin: Cigars of the PharaohTintin: The Blue LotusTintin: The Broken EarTintin: The Black IslandTintin: King Ottakar’s SceptreTintin: The Crab with the Golden ClawsTintin: The Shooting StarTintin: The Secret of the UnicornTintin: Red Rackham’s TreasureTintin: The Seven Crystal BallsTintin: Prisoners of the SunTintin: Land of Black GoldTintin: Destination MoonTintin: Explorers of the MoonTintin: The Calculus AffairTintin: The Red Sea SharksTintin in TibetTintin: The Castafiore EmeraldTintin: Flight 714 to SydneyThe Adventures of Tintin and the PicarosTintin and Alph-Art","['Comics', 'Graphic Novels', 'Bande Dessinée', 'Adventure', 'Fiction', 'Childrens', 'Graphic Novels Comics', 'Comic Book', 'Mystery', 'France']"
"One, Two, Buckle My Shoe",https://www.goodreads.com/book/show/16312.One_Two_Buckle_My_Shoe,"A dentist's suspicious death leads Poirot to drill the good doctor's patients, partners, lovers, and friends.From the Publisher:What reason would an amiable dentist like Dr. Morely have for committing suicide? He didn't have emotional difficulties, money problems, or love trouble. What he did have was an appointment with Hercule Poirot, who is not persuaded by the suicide story and has therefore taken it upon himself to question the good doctor's patients, partners, and friends. All he's come up with is the numbing fear that Dr. Morely wasn't an unlikely victim at all. Nor the first.","['Mystery', 'Fiction', 'Crime', 'Classics', 'Detective', 'Mystery Thriller', 'Audiobook', 'Murder Mystery', 'British Literature', 'Adult']"
The Ghost and Mrs. Muir,https://www.goodreads.com/book/show/20758134-the-ghost-and-mrs-muir,"The book that inspired Joseph L. Mankiewicz’s cinematic romance starring Gene Tierney and Rex Harrison—one of the most passionately romantic movies ever made. • With a foreword by New York Times bestselling author Adriana Trigiani. Burdened by debt after her husband's death, Lucy Muir insists on moving into the very cheap Gull Cottage in the quaint seaside village of Whitecliff, despite multiple warnings that the house is haunted. Upon discovering the rumors to be true, the young widow ends up forming a special companionship with the ghost of handsome former sea captain Daniel Gregg. Through the struggles of supporting her children, seeking out romance from the wrong places, and working to publish the captain's story as a book, Blood and Swash , Lucy finds in her secret relationship with Captain Gregg a comfort and blossoming love she never could have predicted. Originally published in 1945, made into a movie in 1947, and later adapted into a television sitcom in 1968, this romantic tale explores how love can develop without boundaries, both in this life and beyond. Vintage Movie Classics spotlights classic films that have stood the test of time, now rediscovered through the publication of the novels on which they were based.","['Fiction', 'Classics', 'Romance', 'Fantasy', 'Historical Fiction', 'Paranormal', 'Ghosts', 'Ghost Stories', 'Gothic', 'Historical']"
The Secret of the Mansion,https://www.goodreads.com/book/show/183116.The_Secret_of_the_Mansion,"Trixie's summer is going to be sooo boring with her two older brothers away at camp. But then a millionaire's daughter moves into the next-door mansion, an old miser hides a fortune in his decrepit house, and a runaway kid starts hiding out in Sleepyside!""","['Mystery', 'Childrens', 'Fiction', 'Young Adult', 'Middle Grade', 'Classics', 'Adventure', 'Juvenile', 'Mystery Thriller', 'Audiobook']"
The Wayward Bus,https://www.goodreads.com/book/show/78275.The_Wayward_Bus,"In his first novel to follow the publication of his enormous success, The Grapes of Wrath, Steinbeck’s vision comes to life in this imaginative and unsentimental chronicle of a bus traveling California’s back roads, transporting the lost and the lonely, the good and the greedy, the stupid and the scheming, the beautiful and the vicious away from their shattered dreams and, possibly, toward the promise of the future. This edition features an introduction by Gary Scharnhorst.","['Fiction', 'Classics', 'Literature', 'Novels', 'American', 'Literary Fiction', 'The United States Of America', 'Americana', 'Audiobook', '20th Century']"
N or M?,https://www.goodreads.com/book/show/102313.N_or_M_,"The final words of the dying man...the code names of Hitler's most dangerous agents...the mysterious clue that sends Tommy and Tuppence to a seaside resort on a mission of wartime intelligence. But not as husband and wife. As strangers, meeting by chance, setting an elaborate trap for an elusive killer.","['Mystery', 'Fiction', 'Crime', 'Classics', 'Detective', 'Mystery Thriller', 'Thriller', 'British Literature', 'Audiobook', 'Adult']"
The Secret of the Unicorn,https://www.goodreads.com/book/show/179174.The_Secret_of_the_Unicorn,"In this classic graphic novel: Tintin stumbles across a model ship at the Old Street Market. Only it isn't just any model ship-it's the Unicorn, carved by one of Haddock's ancestors, and it holds a clue to finding pirate treasure!","['Comics', 'Graphic Novels', 'Bande Dessinée', 'Adventure', 'Fiction', 'Childrens', 'Comic Book', 'Graphic Novels Comics', 'Mystery', 'France']"
King of the Wind: The Story of the Godolphin Arabian,https://www.goodreads.com/book/show/423156.King_of_the_Wind,"He was named ""Sham"" for the sun, this golden red stallion born in the Sultan of Morocco's stone stables. Upon his heel was a small white spot, the symbol of speed. But on his chest was the symbol of misfortune.Although he was as swift as the desert winds, Sham's proud pedigree would be scorned all his life by cruel masters and owners.This is the classic story of Sham and his friend, the stable boy Agba. Their adventures take them from the sands of the Sahara to the royal courts of France and, finally, to the green pastures and stately homes of England.For Sham was the renowned ""Godolphin Arabian"" whose blood flows through the veins of almost every superior Thoroughbred. Sham's speed-like his story-has become legendary.","['Fiction', 'Horses', 'Historical Fiction', 'Animals', 'Childrens', 'Classics', 'Young Adult', 'Middle Grade', 'Historical', 'Juvenile']"
The Magic Faraway Tree,https://www.goodreads.com/book/show/74998.The_Magic_Faraway_Tree,The Magic Faraway Tree,"['Fantasy', 'Childrens', 'Fiction', 'Classics', 'Adventure', 'Young Adult', 'Magic', 'Middle Grade', 'British Literature', 'Novels']"
The Thief's Journal,https://www.goodreads.com/book/show/328208.The_Thief_s_Journal,"The Thief's Journal is perhaps Jean Genet's most authentically autobiographical novel, personifying his quest for spiritual glory through the pursuit of evil. Writing in the intensely lyrical prose style that is his trademark, the man, Jean Cocteau, dubbed France's ""Black Prince of Letters"" here reconstructs his early adult years - time he spent as a petty criminal and vagabond, traveling through Spain and Antwerp, occasionally border hopping across to the rest of Europe, always trying to stay one step ahead of the authorities.","['Fiction', 'France', 'Queer', 'Literature', 'LGBT', 'Classics', 'French Literature', 'Novels', 'Gay', '20th Century']"
And Both Were Young,https://www.goodreads.com/book/show/790131.And_Both_Were_Young,"Flip doesn't think she'll ever fit in at the Swiss boarding school. Besides being homesick for her father and Connecticut, she isn't sophisticated like the other girls, and discussions about boys leave her tongue-tied. Her happiest times are spent apart from the others, sketching or wandering in the mountains.But the day she's out walking alone and meets a French boy, Paul, things change for Flip. As their relationship grows, so does her self-confidence. Despite her newfound happiness, there are times when Paul seems a stranger to her. And since dating is forbidden except to seniors, their romance must remain a secret. With so many new feelings and obstacles to overcome in her present, can Flip help Paul to confront his troubled past and find a future?","['Young Adult', 'Fiction', 'Romance', 'Historical Fiction', 'Boarding School', 'Coming Of Age', 'Childrens', 'Audiobook', 'Classics', 'Historical']"
The Ox-Bow Incident,https://www.goodreads.com/book/show/659310.The_Ox_Bow_Incident,"Two drifters are drawn into a posse formed to find the murderer of a local man in this wrenching, powerful re-creation of life, death, justice, and mob violence on the Western frontier.","['Fiction', 'Westerns', 'Classics', 'Historical Fiction', 'Literature', 'Novels', 'American', 'Historical', 'Literary Fiction', 'Crime']"
Two Serious Ladies,https://www.goodreads.com/book/show/215262.Two_Serious_Ladies,"Eccentric, adventurous Christina Goering meets the anxious but equally enterprising Mrs. Copperfield at a party.Two serious ladies who want to live outside of themselves, they go in search of salvation: Mrs. Copperfield visits Panama with her husband, where she finds solace among the women who live and work in its brothels; while Miss Goering becomes involved with various men. At the end the two women meet again, each changed by her experience.Mysterious, profound, anarchic and very funny, 'Two Serious Ladies' is a daring, original work that defies analysis.","['Fiction', 'Classics', 'Novels', 'Queer', 'LGBT', 'Womens', 'American', '20th Century', 'Female Authors', 'Literary Fiction']"
"I, the Jury",https://www.goodreads.com/book/show/823561.I_the_Jury,"Here's Mickey Spillane and Mike Hammer in their roughest and readiest--a double-strength shot of sex, violence, and action that is vintage Spillane all the way. It's a tough-guy mystery to please even the most bloodthirsty of fans!","['Mystery', 'Fiction', 'Crime', 'Noir', 'Detective', 'Classics', 'Thriller', 'Hard Boiled', 'Pulp', 'Novels']"
The Lost Weekend,https://www.goodreads.com/book/show/257605.The_Lost_Weekend,"Don Birnam is a sensitive, charming and well-read man. Yet when left alone for a few days by his brother, he struggles with his overwhelming desire for alcohol, succumbs to it and, in the resulting prolonged agony, goes over much of his life up to and including the lost weekend.","['Fiction', 'Classics', 'Novels', 'LGBT', 'American', 'Queer', 'Literary Fiction', '20th Century', 'The United States Of America', 'New York']"
Rabbit Hill,https://www.goodreads.com/book/show/333735.Rabbit_Hill,"It has been a while since Folks lived in the Big House, and an even longer time has passed since there has been a garden at the House. All the animals of the Hill are very excited about the new Folks moving in, and they wonder how things are going to change. It’s only a matter of time before the animals of the Hill find out just who is moving in, and they may be a little bit surprised when they do.","['Childrens', 'Fiction', 'Animals', 'Fantasy', 'Classics', 'Middle Grade', 'Juvenile', 'Young Adult', 'Chapter Books', 'Rabbits']"
